{
  "schema_version": 1,
  "kind": "status_view",
  "rebuilt_through_sequence": 42,
  "entries": [
    {
      "act_body_id": "sha256:0f7c3a91d2b4e5f60718293a4b5c6d7e8f9012345678abcdef0123456789abcd",
      "state": "settled",
      "desired_spec_id": "sha256:3330000000000000000000000000000000000000000000000000000000000005",
      "observed_spec_id": "sha256:3330000000000000000000000000000000000000000000000000000000000005"
    }
  ]
}
